{
    "salles":
    {
        "a":
        {
            "référence": [4, "anti-horaire"],
            "position":
            {
                "rotation":
                {
                    "matrice": [[-1, 0],
                                [0, -1]],
                    "vecteur": [4, 4]
                },
                "translation": [1, 0]
            }
        }
    },
    "personnages":
    [
        {
            "couleur": "bleu",
            "nature": "Gobelin",
            "emplacement":
            {
                "salle": "a",
                "coordonnées": [0, 2]
            },
            "blessé": false
        }
    ],
    "objets":
    [
        {
            "couleur": "bleu",
            "nature": "Trésor",
            "emplacement":
            {
                "salle": "a",
                "coordonnées": [0, 3]
            }
        }
    ],
    "cartes bleues":
    {
        "main":
        {
            "cartes sauts": 1,
            "cartes actions": [2, 4, 5],
            "cartes de combat": [0, 1, 2, 2, 3, 3, 4, 5, 6]
        },
        "défausse":
        {
            "cartes sauts": 2,
            "cartes actions": [3],
            "cartes de combat": []
        }
    },
    "cartes jaunes":
    {
        "main":
        {
            "cartes sauts": 3,
            "cartes actions": [2, 3, 4, 5],
            "cartes de combat": [0, 1, 2, 2, 3, 3, 4, 5, 6]
        },
        "défausse":
        {
            "cartes sauts": 0,
            "cartes actions": [],
            "cartes de combat": []
        }
    },
    "déroulé":
    {
        "scénario": "exemple",
        "joueur résolvant": "bleu",
        "premier joueur": "jaune",
        "joueur actif": "bleu",
        "tour": 7,
        "actions restantes": 3,
        "décision attendue": "Choix d'une action"
    }
}
