{
    "salles":
    {
        "a":
        {
            "référence": [1, "horaire"],
            "position":
            {
                "rotation":
                {
                    "matrice":  [[0, -1],
                                 [1,  0]],
                    "vecteur": [4, 0]
                },
                "translation": [1, 0]
            }
        },
        "b":
        {
            "référence": [1, "anti-horaire"],
            "position":
            {
                "rotation":
                {
                    "matrice":  [[-1,  0],
                                 [ 0, -1]],
                    "vecteur": [4, 4]
                },
                "translation": [1, 5]
            }
        }
    },
    "personnages":
    [
        {
            "couleur": "jaune",
            "nature": "Méchanork",
            "emplacement":
            {
                "salle": "a",
                "coordonnées": [2, 2]
            },
            "blessé": false
        }
    ],
    "objets": [],
    "cartes bleues":
    {
        "main":
        {
            "cartes sauts": 3,
            "cartes actions": [2, 3, 5],
            "cartes de combat": [0, 1, 2, 2, 3, 3, 4, 5, 6]
        },
        "défausse":
        {
            "cartes sauts": 0,
            "cartes actions": [4],
            "cartes de combat": []
        }
    },
    "cartes jaunes":
    {
        "main":
        {
            "cartes sauts": 3,
            "cartes actions": [2, 4, 5],
            "cartes de combat": [0, 1, 2, 2, 3, 3, 4, 5, 6]
        },
        "défausse":
        {
            "cartes sauts": 0,
            "cartes actions": [3],
            "cartes de combat": []
        }
    },
    "déroulé":
    {
        "scénario": "exemple",
        "joueur résolvant": "jaune",
        "premier joueur": "bleu",
        "joueur actif": "jaune",
        "tour": 5,
        "actions restantes": 1,
        "décision attendue": "Choix d'une action"
    }
}
