{
    "salles":
    {
        "g":
        {
            "référence": [3, "horaire"],
            "position":
            {
                "rotation":
                {
                    "matrice": [[1, 0],
                                [0, 1]],
                    "vecteur": [0, 0]
                },
                "translation": [11, 5]
            }
        }
    },
    "personnages":
    [
        {
            "couleur": "bleu",
            "nature": "Clerc",
            "emplacement":
            {
                "salle": "g",
                "coordonnées": [3, 2]
            },
            "blessé": false
        }
    ],
    "objets":
    [
        {
            "couleur": "bleu",
            "nature": "Corde",
            "emplacement":
            {
                "salle": "g",
                "coordonnées": [3, 4]
            }
        }
    ],
    "cartes bleues":
    {
        "main":
        {
            "cartes sauts": 3,
            "cartes actions": [3, 4, 5],
            "cartes de combat": [0, 1, 2, 2, 3, 3, 4, 5, 6]
        },
        "défausse":
        {
            "cartes sauts": 0,
            "cartes actions": [2],
            "cartes de combat": []
        }
    },
    "cartes jaunes":
    {
        "main":
        {
            "cartes sauts": 3,
            "cartes actions": [2, 3, 4, 5],
            "cartes de combat": [0, 1, 2, 2, 3, 3, 4, 5, 6]
        },
        "défausse":
        {
            "cartes sauts": 0,
            "cartes actions": [],
            "cartes de combat": []
        }
    },
    "déroulé":
    {
        "scénario": "exemple",
        "joueur résolvant": "bleu",
        "premier joueur": "bleu",
        "joueur actif": "bleu",
        "tour": 1,
        "actions restantes": 2,
        "décision attendue": "Choix d'une action"
    }
}
