{
    "salles":
    {
        "a":
        {
            "référence": [2, "anti-horaire"],
            "position":
            {
                "rotation":
                {
                    "matrice":  [[0, 1],
                                 [1, 0]],
                    "vecteur": [0, 0]
                },
                "translation": [0, 0]
            }
        }
    },
    "personnages":
    [
        {
            "couleur": "bleu",
            "nature": "Guerrier",
            "emplacement":
            {
                "salle": "a",
                "coordonnées": [0, 0]
            },
            "blessé": false
        },
        {
            "couleur": "jaune",
            "nature": "Passe-muraille",
            "emplacement":
            {
                "salle": "a",
                "coordonnées": [4, 4]
            },
            "blessé": false
        }
    ],
    "objets": [],
    "cartes bleues":
    {
        "main":
        {
            "cartes sauts": 3,
            "cartes actions": [3, 4, 5],
            "cartes de combat": [0, 1, 2, 2, 3, 3, 4, 5, 6]
        },
        "défausse":
        {
            "cartes sauts": 0,
            "cartes actions": [2],
            "cartes de combat": []
        }
    },
    "cartes jaunes":
    {
        "main":
        {
            "cartes sauts": 3,
            "cartes actions": [2, 3, 4, 5],
            "cartes de combat": [0, 1, 2, 2, 3, 3, 4, 5, 6]
        },
        "défausse":
        {
            "cartes sauts": 0,
            "cartes actions": [],
            "cartes de combat": []
        }
    },
    "déroulé":
    {
        "scénario": "exemple",
        "joueur résolvant": "bleu",
        "premier joueur": "bleu",
        "joueur actif": "bleu",
        "tour": 1,
        "actions restantes": 2,
        "décision attendue": "Choix d'une action"
    }
}
